Commit Hash,Aurthor,Week Day,Day,Month,Year,Date,Time,Time Zone,Subject8ccd88a,daflair,Sat,13,Oct,2012,2012-10-13,09:14:03,-0400,"Added TallyStats varmeansq, OutputStats N/pad masks, RegionPlot Zones/ZoneBands, CreateSUP flip/dataImage/sheetImage"ed03626,daflair,Wed,3,Oct,2012,2012-10-03,11:30:50,-0400,"Switched to L-Density; Added @UPLab; Improved stats, overlay, lims; Disabled delayedCall(updateData);"f04f33d,daflair,Wed,19,Sep,2012,2012-09-19,10:24:28,-0400,"Improving tallyRegionStats, outputRegionStats, generateUPStats‰Û_"514e375,daflair,Thu,13,Sep,2012,2012-09-13,06:00:56,-0400,Working on new RegionPlotDataSource & TransientStats upgrades (exporting early series)e638ec1,daflair,Wed,12,Sep,2012,2012-09-12,13:03:06,-0400,Implemented TransientStats; Fixed RegionPlotDataSource (now working so nicely)0ae3dc4,daflair,Wed,12,Sep,2012,2012-09-12,13:01:43,-0400,Implemented DelayedCall for queueRecycleSpace80e268c,daflair,Sat,8,Sep,2012,2012-09-08,19:03:14,-0400,Working on new RegionPlot DataReadere6f206f,daflair,Fri,7,Sep,2012,2012-09-07,22:54:03,-0400,Implemented event-driven DataReader & DataSource (Awesome)b506c90,daflair,Mon,3,Sep,2012,2012-09-03,12:59:02,-0400,Added relative font size in label functions; improved export script62d0161,daflair,Mon,3,Sep,2012,2012-09-03,11:27:14,-0400,Added @UPBeta.TestDataReader002cad8,daflair,Mon,3,Sep,2012,2012-09-03,11:26:48,-0400,Implementing new @Styles648e92b,daflair,Mon,3,Sep,2012,2012-09-03,11:26:33,-0400,Improved plot label0ac48b7,daflair,Mon,3,Sep,2012,2012-09-03,11:26:16,-0400,Improved DataReader290432d9,daflair,Sun,2,Sep,2012,2012-09-02,06:16:13,-0400,"Implemented flip-color map, Fixed outliers sigma issue"c98779e,daflair,Sun,2,Sep,2012,2012-09-02,06:14:24,-0400,Implementing new DataReader with ReaderStates042d3db,daflair,Fri,31,Aug,2012,2012-08-31,18:33:49,-0400,Refactoring DataReader3b4a933,daflair,Fri,31,Aug,2012,2012-08-31,18:33:23,-0400,Implemented label function for RegionStats / PlotLabels; fixes RegionStats.StatsMode issue75d0616,daflair,Thu,30,Aug,2012,2012-08-30,18:25:32,-0400,Implemented ColorBar; Improving Exportb31d86c,daflair,Wed,29,Aug,2012,2012-08-29,20:24:59,-0400,Implemented DataStats for GenerateUPStats & RegionStatsDataSource768c41a,daflair,Wed,29,Aug,2012,2012-08-29,12:24:11,-0400,"Improved grid, subplot data & style, plot label position"dc49a74,daflair,Wed,29,Aug,2012,2012-08-29,12:23:01,-0400,Renamed 'output' folder to 'Output' (title case)3cc4563,daflair,Sun,26,Aug,2012,2012-08-26,13:50:35,-0400,Refactored through Grasppe.MatLab3fadc22,daflair,Mon,20,Aug,2012,2012-08-20,12:57:43,-0400,"Working on plot styling, labels‰Û_ etc."01eff56,daflair,Sun,19,Aug,2012,2012-08-19,11:48:32,-0400,Minor improvements to curve filling8eee058,daflair,Sun,19,Aug,2012,2012-08-19,08:07:21,-0400,Implemented debugStamp(err); Improved spectrum subplots color and splinese485a05,daflair,Sat,18,Aug,2012,2012-08-18,20:15:22,-0400,"Fixing major bugs in loading sequence, improved fill spectra"7bd4a23,daflair,Sat,18,Aug,2012,2012-08-18,12:04:34,-0400,Deleted useless patch data source3648b79,daflair,Sat,18,Aug,2012,2012-08-18,12:04:21,-0400,"Renaming Processor/Reader; Fixing RegionStatsDataSource loading issues; Created CaseData, SetData, SheetData SimpleDataModels; Improved debugStamp; Added mediator construct arguments"de27fa4,daflair,Sat,18,Aug,2012,2012-08-18,06:49:04,-0400,"Implemented export plots script, fixed cmd+shft+h/up/down page controls, basic volume spectra"2ce3248,daflair,Fri,17,Aug,2012,2012-08-17,14:40:06,-0400,"Improved performance, export, setSheet, DataSources, debugStamps"41e190e,daflair,Fri,17,Aug,2012,2012-08-17,10:36:35,-0400,Implementing figure export functionality9c2042c,daflair,Thu,16,Aug,2012,2012-08-16,18:56:00,-0400,Implementing vector export support0d64748,daflair,Thu,16,Aug,2012,2012-08-16,06:02:52,-0400,Added all sheets data gettere9537c7,daflair,Thu,16,Aug,2012,2012-08-16,06:01:26,-0400,Added support for OuterPosition option21ee5f9,daflair,Thu,16,Aug,2012,2012-08-16,06:00:50,-0400,Reorganizing‰Û_f6baf73,daflair,Thu,26,Jul,2012,2012-07-26,13:56:47,-0400,Reorganizing...5ecd42f,daflair,Thu,26,Jul,2012,2012-07-26,13:56:31,-0400,Reorganizing‰Û_6f12ef5,daflair,Thu,26,Jul,2012,2012-07-26,13:55:05,-0400,Clearing outputs8981fe7,daflair,Thu,26,Jul,2012,2012-07-26,10:08:14,-0400,Preparing for SUP2012080cd94d1,daflair,Wed,23,May,2012,2012-05-23,15:27:24,-0400,Minor exception handling in cleardebuga43be51,daflair,Wed,25,Apr,2012,2012-04-25,10:06:08,-0400,Implemented BuildSurfsBuffer scriptd53444b,daflair,Tue,24,Apr,2012,2012-04-24,23:08:13,-0400,Implemented alpha Plot Labels6f0c70e,daflair,Tue,24,Apr,2012,2012-04-24,12:18:15,-0400,Implementing Plot Labels462af57,daflair,Tue,24,Apr,2012,2012-04-24,11:09:46,-0400,"Implemented X/Y-Lim, implementing Plot Labels, fixed empty string Text constructor bug"b83b5ae,daflair,Mon,23,Apr,2012,2012-04-23,12:22:43,-0400,"Working on ColorMaps, beta UPStats data source"7b2812c,daflair,Tue,17,Apr,2012,2012-04-17,06:25:30,-0400,Implementing future Cast/Options enumerations9c4bd20,daflair,Tue,17,Apr,2012,2012-04-17,06:25:01,-0400,Minor optimizations & refactoringefcc573,daflair,Fri,13,Apr,2012,2012-04-13,12:53:00,-0400,Improving efficiency around genvarname617fe71,daflair,Fri,13,Apr,2012,2012-04-13,12:04:07,-0400,"Implemented plot creation / PlotMediator, Improved prototype garbage collection, debugStamp"172b232,daflair,Tue,10,Apr,2012,2012-04-10,06:02:49,-0400,Implementing realtime region stats data source0506a23,daflair,Mon,9,Apr,2012,2012-04-09,08:50:08,-0400,"Extracted ""live"" demo script from ""profile"" test script"cd8d2dc,daflair,Sun,8,Apr,2012,2012-04-08,16:06:40,-0400,Optimized disp & test script009a05f,daflair,Sat,7,Apr,2012,2012-04-07,20:15:24,-0400,Added toolbar creation / initialization  PlotMediatorde7d26f,daflair,Sat,7,Apr,2012,2012-04-07,20:02:39,-0400,Implemented Case / Set toolbar controls35427b1,daflair,Sat,7,Apr,2012,2012-04-07,14:48:21,-0400,Implementing plot Controls / Mediatorab2b911,daflair,Sat,7,Apr,2012,2012-04-07,11:49:48,-0400,Implemented line count / shellfa66196,daflair,Sat,7,Apr,2012,2012-04-07,11:01:29,-0400,"Implemented ModelRecord, Fixed Case/Set/Sheet update bugs, Fixed LocalVariability algorithm for lower frequency patch patterns"2ada995,daflair,Sat,7,Apr,2012,2012-04-07,09:05:12,-0400,"Implemented scatter-raw algorithm base, preparing to rename datasources correctly"60fd9a3,daflair,Fri,6,Apr,2012,2012-04-06,19:21:28,-0400,"Implemented ViewLock, Refactored View / Axes, Fixed TitleText clipping problem"e99688f,daflair,Fri,6,Apr,2012,2012-04-06,16:05:06,-0400,"Implemented CData / DataSource, Fixed OnResize / Figures"2ac5d83,daflair,Fri,6,Apr,2012,2012-04-06,12:47:22,-0400,Refactored DataSource / DataProcessor w/ change eventsc6961b6,daflair,Thu,5,Apr,2012,2012-04-05,19:59:23,-0400,"Implemented on-demand & copyable Models functions, Updated data processor"47d771f,daflair,Thu,5,Apr,2012,2012-04-05,19:57:42,-0400,Depricated w/ warning camelString due to unresolved bugs87c69e8,daflair,Thu,5,Apr,2012,2012-04-05,19:40:25,-0400,Fixed bug caused by camelString in generating data source IDsb44e467,daflair,Thu,5,Apr,2012,2012-04-05,15:51:34,-0400,Implementing DataProcessor loading / processing data55cda02,daflair,Wed,4,Apr,2012,2012-04-04,20:42:17,-0400,Implementing RegionDataSource for statistical plots8f5d3d3,daflair,Wed,4,Apr,2012,2012-04-04,13:35:06,-0400,Refactored AttachMediations < PrepareMediatorca8067f,daflair,Wed,4,Apr,2012,2012-04-04,13:07:34,-0400,Fixed recursive MetaProperty / Decorations bugb3407cf,daflair,Wed,4,Apr,2012,2012-04-04,11:48:13,-0400,Working on Mediator Subjectsb1aaf6c,daflair,Wed,4,Apr,2012,2012-04-04,10:04:51,-0400,Implemented basic OnKeyPress for Window Functions8459d23,daflair,Wed,4,Apr,2012,2012-04-04,09:51:27,-0400,Implemented ResetPlotLimits on AttachDataSourced76f2bc,daflair,Wed,4,Apr,2012,2012-04-04,09:32:02,-0400,Fixed MultiPlotFigure OnResize bug (now working)2dc4095,daflair,Wed,4,Apr,2012,2012-04-04,09:10:37,-0400,Implemented RawUniformityDataSource using TriScatterInterp9788726,daflair,Tue,3,Apr,2012,2012-04-03,12:26:55,-0400,Refactored to create statements function06fa1bf,daflair,Sat,31,Mar,2012,2012-03-31,09:27:45,-0400,"Refactored PropertyDecorator, Implementing MultiPlotFigure"76d8aec,daflair,Fri,30,Mar,2012,2012-03-30,19:34:28,-0400,Fixing hottest on axes vs. surface990335e,daflair,Fri,30,Mar,2012,2012-03-30,17:53:18,-0400,Implemented timer-based mouse click/double click8f4ec11,daflair,Fri,30,Mar,2012,2012-03-30,16:20:25,-0400,Working on panAxes622fadf,daflair,Fri,30,Mar,2012,2012-03-30,14:07:04,-0400,Implementing MouseEventHandler (in progress)da73746,daflair,Fri,30,Mar,2012,2012-03-30,11:51:38,-0400,"Fixed daisy event calls, Handler subclassing, Implemented TextObject, PlotAxes"d38b387,daflair,Fri,30,Mar,2012,2012-03-30,09:42:32,-0400,"Refactored DataSource, Implementier PlotFigure OverlayAxes (working)"5c6d5d5,daflair,Thu,29,Mar,2012,2012-03-29,17:15:10,-0400,Implementing PlotComponent & Surf (in progress)3f696a3,daflair,Thu,29,Mar,2012,2012-03-29,16:46:08,-0400,Fixed / Refactored Data Sources & Models (working LocVar)25f74a4,daflair,Thu,29,Mar,2012,2012-03-29,15:52:53,-0400,"Fixed/Refactored Core, HandleGraphics, Decorator, EventHandler (working!)"a924791,daflair,Thu,29,Mar,2012,2012-03-29,15:52:45,-0400,"Fixed/Refactored Core, HandleGraphics, Decorator, EventHandler (working)"30550f3,daflair,Wed,28,Mar,2012,2012-03-28,18:38:02,-0400,Refactoring Components in to Packagesdbde121,daflair,Tue,27,Mar,2012,2012-03-27,20:21:09,-0400,Working on obj/h callbackEvent consistency70b6073,daflair,Tue,27,Mar,2012,2012-03-27,18:24:58,-0400,Implementing new GrasppeEventHandler23d0557,daflair,Mon,26,Mar,2012,2012-03-26,21:09:21,-0400,Implementing new Prototype (testing NewFigureObject)138d153,daflair,Mon,26,Mar,2012,2012-03-26,09:24:04,-0400,Renamed isValid to validCheckb9c8634,daflair,Mon,26,Mar,2012,2012-03-26,09:23:00,-0400,Renaming isValid to validChecka4a5365,daflair,Sun,25,Mar,2012,2012-03-25,07:02:44,-0400,Fixing GrasppeHandle6fd753e,daflair,Fri,23,Mar,2012,2012-03-23,22:51:56,-0400,Removing default statementseb62290,daflair,Fri,23,Mar,2012,2012-03-23,22:51:30,-0400,Removing default statements (in progress)078fea4,daflair,Fri,23,Mar,2012,2012-03-23,14:38:37,-0400,Reimplemented UniformityDataSource w/ Parameters model94dd376,daflair,Thu,22,Mar,2012,2012-03-22,19:27:11,-0400,Implementing DynamicMediator (success)7c2ac47,daflair,Thu,22,Mar,2012,2012-03-22,18:09:52,-0400,"Implementing Dynamic Mediator, Fixed MetaProperties"a5c45ea,daflair,Thu,22,Mar,2012,2012-03-22,10:37:15,-0400,Fixer immutable InstanceID setting mistakeef109c9,daflair,Wed,21,Mar,2012,2012-03-21,19:07:04,-0400,Implemented prototype MetaProperties processing83472b4,daflair,Wed,21,Mar,2012,2012-03-21,08:54:40,-0400,"Implementing Mediator-Delegate pattern, Implementing debugPrint (extend runlog)"2ac33ef,daflair,Wed,21,Mar,2012,2012-03-21,07:23:06,-0400,Implementing Mediator-Delegator patterne684a97,daflair,Tue,20,Mar,2012,2012-03-20,08:38:55,-0400,Added GrasppePrototype Super Class419807e,daflair,Sun,18,Mar,2012,2012-03-18,10:18:49,-0400,Implemented Prototype-Folders Search Path271878a,daflair,Sun,18,Mar,2012,2012-03-18,10:18:25,-0400,Implemented Prototype-Folders Search Pathc9bb3f0,daflair,Sun,18,Mar,2012,2012-03-18,07:34:33,-0400,Fixed decorator loading order problemse7559d4,daflair,Fri,16,Mar,2012,2012-03-16,21:22:53,-0400,"Improved Dynamic Decorator, implemented OverlayText"af643a7,daflair,Fri,16,Mar,2012,2012-03-16,19:54:00,-0400,Fixed & Improved mouse events53ac41a,daflair,Thu,15,Mar,2012,2012-03-15,23:04:50,-0400,Implemented working MousePan & improved EventHandlerbe18938,daflair,Thu,15,Mar,2012,2012-03-15,20:12:21,-0400,"Improving DataSources, so, Alpha now broken!"38fd752,daflair,Thu,15,Mar,2012,2012-03-15,19:38:32,-0400,Improving MouseEvents & EventHandler functions592238a,daflair,Wed,14,Mar,2012,2012-03-14,20:02:11,-0400,"Implemented Hard-Lim linking, fixed events, superclass calls, code alignment"c30213d,daflair,Tue,13,Mar,2012,2012-03-13,20:22:02,-0400,Fixed MultiPlot Figure Resize8e035b3,daflair,Tue,13,Mar,2012,2012-03-13,20:21:41,-0400,Fixed Multiple Decorator Implementation3fcf6a6,daflair,Tue,13,Mar,2012,2012-03-13,17:45:08,-0400,Implemented GrasppeDecorator (working)0b08fc7,daflair,Tue,13,Mar,2012,2012-03-13,16:35:01,-0400,Implementing Decoratorsec02b4c,daflair,Tue,13,Mar,2012,2012-03-13,11:20:14,-0400,Updated BuildDataBuffers to rebuild without 9 GB merged surfsada8081,daflair,Tue,13,Mar,2012,2012-03-13,10:27:43,-0400,Fixed PlotUPStats-UniformityDataSource couplingeecd361,daflair,Tue,13,Mar,2012,2012-03-13,06:37:31,-0400,Improved multi-plot best-fit logica601f52,daflair,Tue,13,Mar,2012,2012-03-13,06:37:05,-0400,New Improved WorkspaceVariables using VarStruct90d26a2,daflair,Mon,12,Mar,2012,2012-03-12,09:53:35,-0400,Generated Reportsc9d465a,daflair,Sun,11,Mar,2012,2012-03-11,22:12:04,-0400,Fixed issue with on demand GetComponentFields retrieval70dc6b3,daflair,Sun,11,Mar,2012,2012-03-11,09:10:39,-0400,Fixed DataGet/Set Plots-DataSources w/ Testing990ed2e,daflair,Sat,10,Mar,2012,2012-03-10,12:50:52,-0500,Before implementing private ComponentProperties58c3b65,daflair,Fri,9,Mar,2012,2012-03-09,12:11:33,-0500,fixes DataSources issued1bc5ff,daflair,Fri,9,Mar,2012,2012-03-09,11:43:49,-0500,Refactoring Plot Objects/Axes/Figures Prototypes195322e,daflair,Fri,9,Mar,2012,2012-03-09,11:42:40,-0500,"Added BuildBuffer script, Improved DebugStamp, Fixed minor DataStore glitches"8f95940,daflair,Thu,8,Mar,2012,2012-03-08,18:36:35,-0500,Fixed replaced set/get with handleSet/handleGetdcb6c03,daflair,Thu,8,Mar,2012,2012-03-08,12:52:50,-0500,"Fixing Prototypes update issues, implemented debugStamp"22f15b6,daflair,Thu,8,Mar,2012,2012-03-08,12:52:40,-0500,"Fixing Prototypes update issues, implemented debugStamp"7508643,daflair,Thu,8,Mar,2012,2012-03-08,06:04:10,-0500,Early Prototypes Sheet Plots171199b,daflair,Wed,7,Mar,2012,2012-03-07,11:16:06,-0500,Implementier Object/Handle Property Listeners8b51fed,daflair,Tue,6,Mar,2012,2012-03-06,21:10:31,-0500,Refactoring +Plots as .Prototypes1bedb30,daflair,Mon,5,Mar,2012,2012-03-05,06:46:22,-0500,Updating Beta for 2012ad14c665,daflair,Mon,5,Mar,2012,2012-03-05,06:45:50,-0500,Improved Alpha Export Video Threadingf684233,daflair,Thu,1,Mar,2012,2012-03-01,14:17:05,-0500,Implemented threaded Export Videofb0aef7,daflair,Thu,1,Mar,2012,2012-03-01,09:53:12,-0500,Locked Encode Mov apple script file07a930e,daflair,Wed,29,Feb,2012,2012-02-29,23:50:35,-0500,Refactored sup (Alpha) w/ persistent data8d25776,daflair,Tue,28,Feb,2012,2012-02-28,13:18:45,-0500,Refactoring handle get/set functions30c359a,daflair,Tue,28,Feb,2012,2012-02-28,10:21:59,-0500,Fixing event handling and handle creationef01702,daflair,Mon,27,Feb,2012,2012-02-27,21:20:01,-0500,Refactoring Plot Objects in progressb7619f1,daflair,Mon,27,Feb,2012,2012-02-27,21:19:27,-0500,Refactoring Plot Objects in progress60c48ec,daflair,Mon,27,Feb,2012,2012-02-27,07:39:21,-0500,Implementing upSurface in progressbd710cf,daflair,Sat,25,Feb,2012,2012-02-25,06:12:53,-0500,Implementing ViewComponent in progressfff7c2a,daflair,Thu,23,Feb,2012,2012-02-23,20:39:05,-0500,Implementing GrasppeHandle SuperClass & PlotFigure8a40a96,daflair,Thu,23,Feb,2012,2012-02-23,09:39:22,-0500,Implemented upPlot View Classes in progress7ac9246,daflair,Wed,22,Feb,2012,2012-02-22,15:34:50,-0500,Buffering MergeSurfs in progress366570f,daflair,Wed,22,Feb,2012,2012-02-22,14:33:55,-0500,Refactoring PlotStats in Progressbcc4497,daflair,Tue,14,Feb,2012,2012-02-14,17:30:11,-0500,Implementing Plots.Stats in progressc3532c6,daflair,Sat,11,Feb,2012,2012-02-11,09:05:58,-0500,Refactoring / Redesiging Stats Plotting9ba62c9,daflair,Wed,8,Feb,2012,2012-02-08,18:18:04,-0500,(WIP) Refactoring everything packages00eb79c,daflair,Mon,6,Feb,2012,2012-02-06,11:05:25,-0500,"Implemented Delta / Relative Stats, Improved runlog"139bb88,daflair,Mon,30,Jan,2012,2012-01-30,09:37:59,-0500,Added/Integrated EncodeMov.scpt w/ testStats426360e,daflair,Mon,30,Jan,2012,2012-01-30,07:47:07,-0500,"Implementier multi-type testStats, Fixed default when"970f3a4,daflair,Wed,25,Jan,2012,2012-01-25,21:54:28,-0500,Ignoring Output591161c,daflair,Wed,25,Jan,2012,2012-01-25,18:00:21,-0500,Implemented working runlog in exportStats / testStats3a0c9af,daflair,Wed,25,Jan,2012,2012-01-25,17:15:34,-0500,Implementing runlog00e7645,daflair,Wed,25,Jan,2012,2012-01-25,11:28:47,-0500,"Added stats for zoneBand, Implemented default, when, resolve, exists functions, Improved testStats/exportStats"9cb7adf,daflair,Wed,18,Jan,2012,2012-01-18,21:16:27,-0500,"Added supPlotStats, testStats, exportStats (w/ output)"edc0ff9,daflair,Thu,8,Dec,2011,2011-12-08,09:23:21,-0500,"Moved folder to ~/Documents/Workspace/MATLAB, Updated source to work with new datadir(varargin)"ef11d7f,daflair,Thu,1,Dec,2011,2011-12-01,12:13:37,-0500,Forced github Error Recovery Snapshot2f63d21,daflair,Mon,18,Jul,2011,2011-07-18,08:43:52,-0400,Imported previous MatLab project SUP201010